{
  "schema_version": "community-signals/v1",
  "sharing_enabled": false,
  "generated_at": "2026-05-28T14:33:09Z",
  "producer": {
    "instance_id_hash": "sha256:adca87cc1cdcd8cce4843c693e45039d87b70a8d1fec1352692aab4ed744acef",
    "organization_id_hash": "sha256:4d738adaaa58f33704701176d0199604ceb558cfd0d973f09151ef185eb97bca",
    "tallow_version": "test"
  },
  "signals": [],
  "privacy": {
    "raw_artifacts_included": false,
    "private_repo_names_included": false,
    "users_included": false,
    "secrets_included": false,
    "redaction_policy_version": "redaction-v1"
  }
}
